地区,抓取日期,公司名,车票名称,目录发售期间,详情页标题,相关信息,咨询,自由乘车区间,可利用设备,限制事项,价格,有效期间,详情发售期间,利用期间,发售处,其他详情字段,详情全文,详情页链接,详情页内链接,详情页图片链接,目录页链接,抓取错误
北信越,2026-05-26,ＪＲ東日本,信州ワンデーパス,発売中,信州ワンデーパス,ＪＲ東日本,ＪＲ東日本 TEL:,信州ワンデーパス /,新幹線特急・急行快速・普通 グリーンライナー指定自由 ▲▲▲▲▲○ ○：乗車可 ▲：乗車券のみ有効 ×：乗車不可 /,,"おとな：2,830円 こども：1,110円",１日間,通年,通年,"フリー区間内のＪＲ駅のみどりの窓口,びゅうプラザ",,"信州ワンデーパス || 関連情報 | ＪＲ東日本 || 問合わせ | ＪＲ東日本 TEL: || フリー区間 | 信州ワンデーパス / || 利用可能設備 | 新幹線特急・急行快速・普通 グリーンライナー指定自由 ▲▲▲▲▲○ ○：乗車可 ▲：乗車券のみ有効 ×：乗車不可 / || 制限事項 || ねだん | おとな：2,830円 こども：1,110円 || 有効期間 | １日間 || 発売期間 | 通年 || 利用期間 | 通年 || 発売箇所 | フリー区間内のＪＲ駅のみどりの窓口,びゅうプラザ",https://www2s.biglobe.ne.jp/~t_aoyagi/railway/free/jreast66.htm,http://www.jreast.co.jp/tickets/info.aspx?GoodsCd=2466,https://www2s.biglobe.ne.jp/~t_aoyagi/railway/free/gazou/jreast63.jpg | https://www2s.biglobe.ne.jp/~t_aoyagi/railway/free/map/jreast66.gif,https://www2s.biglobe.ne.jp/~t_aoyagi/railway/free/hokusinetu.htm,
北信越,2026-05-26,ＪＲ東日本,えちごワンデーパス,終了,えちごワンデーパス,ＪＲ東日本,ＪＲ東日本 TEL:,えちごワンデーパス /,新幹線特急・急行快速・普通 グリーンライナー指定自由 ▲▲▲▲▲○ ○：乗車可 ▲：乗車券のみ有効 ×：乗車不可 /,,"大人：1,570円／小人：780円",１日,～2025年3月31日,～2025年3月31日,フリー区間内の主な駅,,"えちごワンデーパス || 関連情報 | ＪＲ東日本 || 問合わせ | ＪＲ東日本 TEL: || フリー区間 | えちごワンデーパス / || 利用可能設備 | 新幹線特急・急行快速・普通 グリーンライナー指定自由 ▲▲▲▲▲○ ○：乗車可 ▲：乗車券のみ有効 ×：乗車不可 / || 制限事項 || ねだん | 大人：1,570円／小人：780円 || 有効期間 | １日 || 発売期間 | ～2025年3月31日 || 利用期間 | ～2025年3月31日 || 発売箇所 | フリー区間内の主な駅",https://www2s.biglobe.ne.jp/~t_aoyagi/railway/free/jreast58.htm,http://www.jreast.co.jp/tickets/info.aspx?GoodsCd=2499,https://www2s.biglobe.ne.jp/~t_aoyagi/railway/free/map/jreast58.gif,https://www2s.biglobe.ne.jp/~t_aoyagi/railway/free/hokusinetu.htm,
北信越,2026-05-26,ＪＲ東日本,えちごツーデーパス,～2027/3/27,えちごツーデーパス,ＪＲ東日本,ＪＲ東日本 TEL:,えちごツーデーパス /,新幹線特急・急行快速・普通 グリーンライナー指定自由 ▲▲▲▲▲○ ○：乗車可 ▲：乗車券のみ有効 ×：乗車不可 /,,"大人：3,300円／小人：1,650円 /",２日間,～2027年3月27日 /,"～2027年3月28日までの金･土･日･祝日,GW,夏休み及び年末年始及びその他設定日の連続する２日間 / 詳細は、こちらによる。 /","フリー区間内の主な駅 / えちごトキめき鉄道：春日山,高田,新井,妙高高原,糸魚川",,"えちごツーデーパス || 関連情報 | ＪＲ東日本 || 問合わせ | ＪＲ東日本 TEL: || フリー区間 | えちごツーデーパス / || 利用可能設備 | 新幹線特急・急行快速・普通 グリーンライナー指定自由 ▲▲▲▲▲○ ○：乗車可 ▲：乗車券のみ有効 ×：乗車不可 / || 制限事項 || ねだん | 大人：3,300円／小人：1,650円 / || 有効期間 | ２日間 || 発売期間 | ～2027年3月27日 / || 利用期間 | ～2027年3月28日までの金･土･日･祝日,GW,夏休み及び年末年始及びその他設定日の連続する２日間 / 詳細は、こちらによる。 / || 発売箇所 | フリー区間内の主な駅 / えちごトキめき鉄道：春日山,高田,新井,妙高高原,糸魚川",https://www2s.biglobe.ne.jp/~t_aoyagi/railway/free/jreast60.htm,http://www.jreast.co.jp/tickets/info.aspx?GoodsCd=2993 | https://www.jreast.co.jp/tickets/pdfFile.aspx?GoodsCd=2993&No=07,https://www2s.biglobe.ne.jp/~t_aoyagi/railway/free/map/jreast60.gif,https://www2s.biglobe.ne.jp/~t_aoyagi/railway/free/hokusinetu.htm,
北信越,2026-05-26,ＪＲ西日本,北陸おでかけtabiwaパス 【当日購入不可】,2026/3/1 / ～2027/3/28,北陸おでかけtabiwaパス,tabiwa,ＪＲ西日本,北陸おでかけtabiwaパス,新幹線ＪＲ特急・急行快速・普通 ライナー指定自由 ×▲▲▲○ ○：乗車可 ▲：乗車券のみ有効 ×：乗車不可 /,普通列車(新快速・快速を含む)の普通車自由席に乗車可。 特急・急行列車は、別途特急券、急行券等が必要。 新幹線には乗車できない。,"大人：2,950円／小人：1,180円",１日間,2026年3月1日～2027年3月28日 / 3日前まで,2026年4月1日～2027年3月31日,tabiwa,,"北陸おでかけtabiwaパス || 関連情報 | tabiwa || 問合わせ | ＪＲ西日本 || フリー区間 | 北陸おでかけtabiwaパス || 利用可能設備 | 新幹線ＪＲ特急・急行快速・普通 ライナー指定自由 ×▲▲▲○ ○：乗車可 ▲：乗車券のみ有効 ×：乗車不可 / || 制限事項 | 普通列車(新快速・快速を含む)の普通車自由席に乗車可。 特急・急行列車は、別途特急券、急行券等が必要。 新幹線には乗車できない。 || ねだん | 大人：2,950円／小人：1,180円 || 有効期間 | １日間 || 発売期間 | 2026年3月1日～2027年3月28日 / 3日前まで || 利用期間 | 2026年4月1日～2027年3月31日 || 発売箇所 | tabiwa",https://www2s.biglobe.ne.jp/~t_aoyagi/railway/free/jrwest41.htm,https://app.tabi-wester.westjr.co.jp/eticketDetails?ticket_id=J0001100,https://www2s.biglobe.ne.jp/~t_aoyagi/railway/free/map/jrwest41.gif,https://www2s.biglobe.ne.jp/~t_aoyagi/railway/free/hokusinetu.htm,
北信越,2026-05-26,ＪＲ西日本,金沢能登tabiwaパス,2026/3/1 / ～2027/3/31,金沢能登tabiwaパス,tabiwa,ＪＲ西日本,金沢能登tabiwaパス,新幹線ＪＲ特急・急行快速・普通 ライナー指定自由 ×▲▲▲○ ○：乗車可 ▲：乗車券のみ有効 ×：乗車不可 /,普通列車(新快速・快速を含む)の普通車自由席に乗車可。 特急・急行列車は、別途特急券、急行券等が必要。 新幹線には乗車できない。,"大人：3,250円／小人：1,620円",2日間,2026年3月1日～2027年3月31日,2026年4月1日～2027年4月1日,tabiwa,,"金沢能登tabiwaパス || 関連情報 | tabiwa || 問合わせ | ＪＲ西日本 || フリー区間 | 金沢能登tabiwaパス || 利用可能設備 | 新幹線ＪＲ特急・急行快速・普通 ライナー指定自由 ×▲▲▲○ ○：乗車可 ▲：乗車券のみ有効 ×：乗車不可 / || 制限事項 | 普通列車(新快速・快速を含む)の普通車自由席に乗車可。 特急・急行列車は、別途特急券、急行券等が必要。 新幹線には乗車できない。 || ねだん | 大人：3,250円／小人：1,620円 || 有効期間 | 2日間 || 発売期間 | 2026年3月1日～2027年3月31日 || 利用期間 | 2026年4月1日～2027年4月1日 || 発売箇所 | tabiwa",https://www2s.biglobe.ne.jp/~t_aoyagi/railway/free/jrwest46.htm,https://app.tabi-wester.westjr.co.jp/eticketDetails?ticket_id=J0001500,https://www2s.biglobe.ne.jp/~t_aoyagi/railway/free/map/jrwest46.gif,https://www2s.biglobe.ne.jp/~t_aoyagi/railway/free/hokusinetu.htm,
北信越,2026-05-26,ＪＲ西日本,小浜線tabiwaパス,2026/3/1 / ～2027/3/31,小浜線tabiwaパス,tabiwa,ＪＲ西日本,小浜線tabiwaパス,新幹線ＪＲ特急・急行快速・普通 ライナー指定自由 ×▲▲▲○ ○：乗車可 ▲：乗車券のみ有効 ×：乗車不可 /,普通列車(新快速・快速を含む)の普通車自由席に乗車可。 特急・急行列車は、別途特急券、急行券等が必要。 新幹線には乗車できない。,"大人：2,200円／小人：1,600円",２日間,2026年3月1日～2027年3月31日,2026年4月1日～2027年4月1日,tabiwa,,"小浜線tabiwaパス || 関連情報 | tabiwa || 問合わせ | ＪＲ西日本 || フリー区間 | 小浜線tabiwaパス || 利用可能設備 | 新幹線ＪＲ特急・急行快速・普通 ライナー指定自由 ×▲▲▲○ ○：乗車可 ▲：乗車券のみ有効 ×：乗車不可 / || 制限事項 | 普通列車(新快速・快速を含む)の普通車自由席に乗車可。 特急・急行列車は、別途特急券、急行券等が必要。 新幹線には乗車できない。 || ねだん | 大人：2,200円／小人：1,600円 || 有効期間 | ２日間 || 発売期間 | 2026年3月1日～2027年3月31日 || 利用期間 | 2026年4月1日～2027年4月1日 || 発売箇所 | tabiwa",https://www2s.biglobe.ne.jp/~t_aoyagi/railway/free/jrwest40.htm,https://app.tabi-wester.westjr.co.jp/eticketDetails?ticket_id=J0001200,https://www2s.biglobe.ne.jp/~t_aoyagi/railway/free/map/jrwest34.gif,https://www2s.biglobe.ne.jp/~t_aoyagi/railway/free/hokusinetu.htm,
北信越,2026-05-26,ＪＲ西日本,越前tabiwaパス,2026/3/1 / ～2027/3/31,越前tabiwaパス,tabiwa,ＪＲ西日本,越前tabiwaパス,新幹線ＪＲ特急・急行快速・普通 ライナー指定自由 ×▲▲▲○ ○：乗車可 ▲：乗車券のみ有効 ×：乗車不可 /,普通列車(新快速・快速を含む)の普通車自由席に乗車可。 特急・急行列車は、別途特急券、急行券等が必要。 新幹線には乗車できない。,"大人：2,300円／小人：1,200円",２日間,2026年3月1日～2027年3月31日,2026年4月1日～2027年4月1日,tabiwa,,"越前tabiwaパス || 関連情報 | tabiwa || 問合わせ | ＪＲ西日本 || フリー区間 | 越前tabiwaパス || 利用可能設備 | 新幹線ＪＲ特急・急行快速・普通 ライナー指定自由 ×▲▲▲○ ○：乗車可 ▲：乗車券のみ有効 ×：乗車不可 / || 制限事項 | 普通列車(新快速・快速を含む)の普通車自由席に乗車可。 特急・急行列車は、別途特急券、急行券等が必要。 新幹線には乗車できない。 || ねだん | 大人：2,300円／小人：1,200円 || 有効期間 | ２日間 || 発売期間 | 2026年3月1日～2027年3月31日 || 利用期間 | 2026年4月1日～2027年4月1日 || 発売箇所 | tabiwa",https://www2s.biglobe.ne.jp/~t_aoyagi/railway/free/jrwest42.htm,https://app.tabi-wester.westjr.co.jp/eticketDetails?ticket_id=J0001300,https://www2s.biglobe.ne.jp/~t_aoyagi/railway/free/map/jrwest42.gif,https://www2s.biglobe.ne.jp/~t_aoyagi/railway/free/hokusinetu.htm,
北信越,2026-05-26,ＪＲ西日本,とやま周遊２dayパス,2025/3/1 / ～2026/3/31,とやま周遊２dayパス,tabiwa 富山地方鉄道 あいの風とやま鉄道 万葉線 / myroute,富山myroute推進協議会 /,とやま周遊２dayパス,新幹線ＪＲ特急・急行快速・普通 ライナー指定自由 ×▲▲▲○ ○：乗車可 ▲：乗車券のみ有効 ×：乗車不可 /,普通列車(新快速・快速を含む)の普通車自由席に乗車可。 特急・急行列車は、別途特急券、急行券等が必要。 新幹線には乗車できない。,"大人：1,550円／小人：770円",２日間,2026年3月1日～2027年3月31日,2026年4月1日～2027年4月1日,tabiwa my route(マイルート),,"とやま周遊２dayパス || 関連情報 | tabiwa 富山地方鉄道 あいの風とやま鉄道 万葉線 / myroute || 問合わせ | 富山myroute推進協議会 / || フリー区間 | とやま周遊２dayパス || 利用可能設備 | 新幹線ＪＲ特急・急行快速・普通 ライナー指定自由 ×▲▲▲○ ○：乗車可 ▲：乗車券のみ有効 ×：乗車不可 / || 制限事項 | 普通列車(新快速・快速を含む)の普通車自由席に乗車可。 特急・急行列車は、別途特急券、急行券等が必要。 新幹線には乗車できない。 || ねだん | 大人：1,550円／小人：770円 || 有効期間 | ２日間 || 発売期間 | 2026年3月1日～2027年3月31日 || 利用期間 | 2026年4月1日～2027年4月1日 || 発売箇所 | tabiwa my route(マイルート)",https://www2s.biglobe.ne.jp/~t_aoyagi/railway/free/jrwest39.htm,https://app.tabi-wester.westjr.co.jp/eticketDetails?ticket_id=J0001600 | https://top.myroute.fun/ticket/toyama#toyamawide | https://toyama-city.myroute.fun/info/459/ | https://www.chitetsu.co.jp/?p=63386,https://www2s.biglobe.ne.jp/~t_aoyagi/railway/free/map/jrwest38.gif,https://www2s.biglobe.ne.jp/~t_aoyagi/railway/free/hokusinetu.htm,
北信越,2026-05-26,ＪＲ西日本,WESTERポイント 北陸新幹線フリーパス（全ポイント）,終了,WESTERポイント 北陸新幹線フリーパス（全ポイント）,JRおでかけネット,ＪＲ西日本,WESTERポイント 北陸新幹線フリーパス（全ポイント）,東海道新幹線山陽新幹線北陸新幹線在来線特急・急行快速・普通 グリーン車普通車指定普通車自由グランクラスグリーン車普通車指定普通車自由寝台車グリーン車普通車指定普通車自由グリーン車指定グリーン車自由ライナー指定自由 －－－－×▲△○－－－－－－－－－ ○：乗車可 ▲：乗車券のみ有効 △：6回まで / ×：乗車不可 －：設定なし /,WESTERポイントでのみ購入可能 指定席は6回まで利用可能 指定席が満席の場合は立席が利用可能,"大人：3,000ポイント／小人：1,500ポイント",３日間,2025年9月1日～2025年12月23日,2025年10月1日～2025年21月25日,JRおでかけネット,,"WESTERポイント 北陸新幹線フリーパス（全ポイント） || 関連情報 | JRおでかけネット || 問合わせ | ＪＲ西日本 || フリー区間 | WESTERポイント 北陸新幹線フリーパス（全ポイント） || 利用可能設備 | 東海道新幹線山陽新幹線北陸新幹線在来線特急・急行快速・普通 グリーン車普通車指定普通車自由グランクラスグリーン車普通車指定普通車自由寝台車グリーン車普通車指定普通車自由グリーン車指定グリーン車自由ライナー指定自由 －－－－×▲△○－－－－－－－－－ ○：乗車可 ▲：乗車券のみ有効 △：6回まで / ×：乗車不可 －：設定なし / || 制限事項 | WESTERポイントでのみ購入可能 指定席は6回まで利用可能 指定席が満席の場合は立席が利用可能 || ねだん | 大人：3,000ポイント／小人：1,500ポイント || 有効期間 | ３日間 || 発売期間 | 2025年9月1日～2025年12月23日 || 利用期間 | 2025年10月1日～2025年21月25日 || 発売箇所 | JRおでかけネット",https://www2s.biglobe.ne.jp/~t_aoyagi/railway/free/jrwest44.htm,https://tickets.jr-odekake.net/shohindb/view/consumer/tokutoku/detail.html?shnId=125000259 | https://www.jr-odekake.net/goyoyaku/campaign/hokurikufree/,https://www2s.biglobe.ne.jp/~t_aoyagi/railway/free/map/jrwest44.gif,https://www2s.biglobe.ne.jp/~t_aoyagi/railway/free/hokusinetu.htm,
北信越,2026-05-26,ＪＲ西日本,WESTERポイント 北陸新幹線フリーパス（一部ポイント）,終了,WESTERポイント 北陸新幹線フリーパス（一部ポイント）,JRおでかけネット,ＪＲ西日本,WESTERポイント 北陸新幹線フリーパス（一部ポイント）,東海道新幹線山陽新幹線北陸新幹線在来線特急・急行快速・普通 グリーン車普通車指定普通車自由グランクラスグリーン車普通車指定普通車自由寝台車グリーン車普通車指定普通車自由グリーン車指定グリーン車自由ライナー指定自由 －－－－×▲△○－－－－－－－－－ ○：乗車可 ▲：乗車券のみ有効 △：6回まで / ×：乗車不可 －：設定なし /,WESTERポイントでのみ購入可能 指定席は6回まで利用可能 指定席が満席の場合は立席が利用可能,"大人：110ポイント＋10,110円／小人：110ポイント＋5,110円",３日間,2025年9月1日～2025年12月23日,2025年10月1日～2025年21月25日,JRおでかけネット,,"WESTERポイント 北陸新幹線フリーパス（一部ポイント） || 関連情報 | JRおでかけネット || 問合わせ | ＪＲ西日本 || フリー区間 | WESTERポイント 北陸新幹線フリーパス（一部ポイント） || 利用可能設備 | 東海道新幹線山陽新幹線北陸新幹線在来線特急・急行快速・普通 グリーン車普通車指定普通車自由グランクラスグリーン車普通車指定普通車自由寝台車グリーン車普通車指定普通車自由グリーン車指定グリーン車自由ライナー指定自由 －－－－×▲△○－－－－－－－－－ ○：乗車可 ▲：乗車券のみ有効 △：6回まで / ×：乗車不可 －：設定なし / || 制限事項 | WESTERポイントでのみ購入可能 指定席は6回まで利用可能 指定席が満席の場合は立席が利用可能 || ねだん | 大人：110ポイント＋10,110円／小人：110ポイント＋5,110円 || 有効期間 | ３日間 || 発売期間 | 2025年9月1日～2025年12月23日 || 利用期間 | 2025年10月1日～2025年21月25日 || 発売箇所 | JRおでかけネット",https://www2s.biglobe.ne.jp/~t_aoyagi/railway/free/jrwest45.htm,https://tickets.jr-odekake.net/shohindb/view/consumer/tokutoku/detail.html?shnId=125000258,https://www2s.biglobe.ne.jp/~t_aoyagi/railway/free/map/jrwest44.gif,https://www2s.biglobe.ne.jp/~t_aoyagi/railway/free/hokusinetu.htm,
北信越,2026-05-26,北越急行,ほくほくワンデーパス,発売中,ほくほくワンデーパス,北越急行,北越急行 TEL:025-752-0770,/ ほくほくワンデーパス,,特急利用不可,"大人：1,800円／小人：900円",1日間,利用当日のみ,通年,"窓口：ほくほく線・十日町駅,えちごトキめき鉄道・直江津駅 / 券売機：六日町(改札内),魚沼丘陵,しんざ,十日町,まつだい,ほくほく大島,虫川大杉,うらがわら,くびき / ほくほく線列車内 / セブンチケット",,"ほくほくワンデーパス || 関連情報 | 北越急行 || 問合わせ | 北越急行 TEL:025-752-0770 || フリー区間 | / ほくほくワンデーパス || 制限事項 | 特急利用不可 || ねだん | 大人：1,800円／小人：900円 || 有効期間 | 1日間 || 発売期間 | 利用当日のみ || 利用期間 | 通年 || 発売箇所 | 窓口：ほくほく線・十日町駅,えちごトキめき鉄道・直江津駅 / 券売機：六日町(改札内),魚沼丘陵,しんざ,十日町,まつだい,ほくほく大島,虫川大杉,うらがわら,くびき / ほくほく線列車内 / セブンチケット",https://www2s.biglobe.ne.jp/~t_aoyagi/railway/free/hokuhoku01.htm,https://7ticket.jp/s/114268/d | https://hokuhoku.co.jp/pdf/oneday.pdf,https://www2s.biglobe.ne.jp/~t_aoyagi/railway/free/map/hokuhoku.gif,https://www2s.biglobe.ne.jp/~t_aoyagi/railway/free/hokusinetu.htm,
北信越,2026-05-26,北越急行,ほくほく線 周学ミステリーパス,終了,ほくほく線 周学ミステリーパス,北越急行,北越急行 TEL:025-750-1251,/ ほくほく線 周学ミステリーパス,,,"大人：1,400円",1日間,2024年10月1日～2024年11月30日,2024年10月1日～2024年11月30日,十日町 / 松代･松之山温泉観光案内所(まつだい駅隣接 ),,"ほくほく線 周学ミステリーパス || 関連情報 | 北越急行 || 問合わせ | 北越急行 TEL:025-750-1251 || フリー区間 | / ほくほく線 周学ミステリーパス || 制限事項 || ねだん | 大人：1,400円 || 有効期間 | 1日間 || 発売期間 | 2024年10月1日～2024年11月30日 || 利用期間 | 2024年10月1日～2024年11月30日 || 発売箇所 | 十日町 / 松代･松之山温泉観光案内所(まつだい駅隣接 )",https://www2s.biglobe.ne.jp/~t_aoyagi/railway/free/hokuhoku92.htm,https://www.hokuhoku.co.jp/press/20240927.pdf,https://www2s.biglobe.ne.jp/~t_aoyagi/railway/free/map/hokuhoku91.gif,https://www2s.biglobe.ne.jp/~t_aoyagi/railway/free/hokusinetu.htm,
北信越,2026-05-26,えちごトキめき鉄道,トキ鉄ツアーパス,発売中,トキ鉄ツアーパス,えちごトキめき鉄道 あいの風とやま鉄道,直江津駅 TEL:025-543-3160,トキ鉄ツアーパス,,特急「しらゆき」の普通車自由席に乗車可。「えちごトキめきリゾート雪月花」は乗車不可,"大人：2,400円／小人：1,200円",１日間,通年,通年,"えちごトキめき鉄道：直江津,春日山,高田,上越妙高,新井,関山,妙高高原,能生,糸魚川,えちごトキめき鉄道列車内 / あいの風とやま鉄道：泊",,"トキ鉄ツアーパス || 関連情報 | えちごトキめき鉄道 あいの風とやま鉄道 || 問合わせ | 直江津駅 TEL:025-543-3160 || フリー区間 | トキ鉄ツアーパス || 制限事項 | 特急「しらゆき」の普通車自由席に乗車可。「えちごトキめきリゾート雪月花」は乗車不可 || ねだん | 大人：2,400円／小人：1,200円 || 有効期間 | １日間 || 発売期間 | 通年 || 利用期間 | 通年 || 発売箇所 | えちごトキめき鉄道：直江津,春日山,高田,上越妙高,新井,関山,妙高高原,能生,糸魚川,えちごトキめき鉄道列車内 / あいの風とやま鉄道：泊",https://www2s.biglobe.ne.jp/~t_aoyagi/railway/free/echigo03.htm,http://www.echigo-tokimeki.co.jp/ticket/plan/#tokitetsutour | https://ainokaze.co.jp/ticket/plan#s08,https://www2s.biglobe.ne.jp/~t_aoyagi/railway/free/map/echigotokimeki.gif,https://www2s.biglobe.ne.jp/~t_aoyagi/railway/free/hokusinetu.htm,
北信越,2026-05-26,えちごトキめき鉄道,トキ鉄18きっぷ,2026/7/18 / ～9/8,トキ鉄18きっぷ,えちごトキめき鉄道,えちごトキめき鉄道総務企画部営業課 TEL:025-546-5521,トキ鉄18きっぷ,,当日有効の「青春18きっぷ」を所持する場合に発売。特急「しらゆき」乗車は乗車不可。えちごトキめきリゾート雪月花は乗車不可,"大人：1,200円",１日間,2026年3月1日～2026年4月10日 / 2026年7月18日～2026年9月8日 / 2026年12月11日～2027年1月11日 /,発売当日限り,"直江津,春日山,高田,上越妙高,新井,妙高高原,能生,糸魚川,えちごトキめき鉄道列車内",,"トキ鉄18きっぷ || 関連情報 | えちごトキめき鉄道 || 問合わせ | えちごトキめき鉄道総務企画部営業課 TEL:025-546-5521 || フリー区間 | トキ鉄18きっぷ || 制限事項 | 当日有効の「青春18きっぷ」を所持する場合に発売。特急「しらゆき」乗車は乗車不可。えちごトキめきリゾート雪月花は乗車不可 || ねだん | 大人：1,200円 || 有効期間 | １日間 || 発売期間 | 2026年3月1日～2026年4月10日 / 2026年7月18日～2026年9月8日 / 2026年12月11日～2027年1月11日 / || 利用期間 | 発売当日限り || 発売箇所 | 直江津,春日山,高田,上越妙高,新井,妙高高原,能生,糸魚川,えちごトキめき鉄道列車内",https://www2s.biglobe.ne.jp/~t_aoyagi/railway/free/echigo93.htm,https://www.echigo-tokimeki.co.jp/information/detail?id=2252,https://www2s.biglobe.ne.jp/~t_aoyagi/railway/free/map/echigotokimeki.gif,https://www2s.biglobe.ne.jp/~t_aoyagi/railway/free/hokusinetu.htm,
